{"platform":"gog","generated":"2026-10-30","schema":1,"source":"GOG's catalog","games":{"1080011325":[20261111,"Wall World Strategy"],"1106360719":[20261203,"SOMBRAS: negative frames"],"1134279270":[20270107,"Emberville"],"1566560444":[20261118,"Space Station Designer"],"1852509608":[20261104,"Abashed"],"1921305722":[20261105,"Underkeep"],"1953477878":[20270310,"Trainwatch"],"1980751921":[20261110,"Vampire: The Masquerade - Oaths & Ashes"],"2015047607":[20270208,"Outward 2"],"2068449424":[20261110,"Warhammer Survivors"],"2070989186":[20261103,"Project Afterfall"],"2140964530":[20261110,"After the Wane"]}}
