{"schema":1,"platform":"switch","generated":"2026-10-30","source":"blawar/titledb (US.en.json)","games":{"0100050026158000":[20261103,"Let's Sing 2027"],"0100060027530000":[20261106,"Hasbro Games™ Junior Collection"],"01000870290F4000":[20261101,"Tarot Tokens"],"01000F1021FB0000":[20261203,"DRAGON QUEST MONSTERS: The Withered World"],"01001C2028ED2000":[20270211,"Astonishia Story"],"0100305027340000":[20261225,"Power Racing Bundle 4"],"01003F501F012000":[20261209,"Aeruta"],"0100450029360000":[20261105,"MANIC MINER"],"01005C1023928000":[20261203,"Fall Up"],"0100643028646000":[20261111,"Prinny Party: Going Overboard!"],"0100B7C00933A000":[20261112,"Pikmin™ 4 – Nintendo Switch™ 2 Edition + Dandori Academy"],"0100D80024146000":[20261126,"Marupoyo: The Round Chick's Adventure"],"0100F550276E0000":[20270216,"Yu-Gi-Oh! TAG FORCE GX"]}}
