{"platform":"xbox","generated":"2026-10-30","schema":1,"source":"Microsoft Store's catalog","games":{"9N6HNLVW5RJV":[20270225,"Atelier Karia: The Night Kingdom & the Guide of Memories"],"9N9K5QP9G3GL":[20261104,"VOID/BREAKER (Game Preview)"],"9NFW93G1GFXG":[20270304,"Wo Long 2: Wings of Ember"],"9NLZ1QJKT090":[20270311,"Road Kings"],"9NT5PB1RZ9LD":[20270204,"METRO 2039"],"9NZRHCH0PL9B":[20270407,"EXODUS"]}}
